{
  "$schema": "http://json-schema.org/draft-07/schema#",
  "title": "trace agent-mode output envelope",
  "description": "Stable agent-mode JSON envelope produced by `trace --json`. All RTLScanner subcommands share the same top-level shape.",
  "type": "object",
  "required": [
    "tool",
    "version",
    "status",
    "command",
    "data",
    "diagnostics",
    "errors",
    "summary"
  ],
  "properties": {
    "tool": {
      "type": "string",
      "const": "trace"
    },
    "version": {
      "type": "string"
    },
    "status": {
      "type": "string",
      "enum": [
        "ok",
        "error"
      ]
    },
    "command": {
      "type": "object",
      "description": "Echo of the parsed argparse Namespace minus output flags."
    },
    "data": {
      "oneOf": [
        {
          "type": "object",
          "required": [
            "mode",
            "scope"
          ],
          "properties": {
            "mode": {
              "type": "string",
              "const": "signal"
            },
            "scope": {
              "type": "string"
            },
            "results": {
              "type": "array",
              "items": {
                "type": "object",
                "required": [
                  "signal",
                  "scope"
                ],
                "properties": {
                  "signal": {
                    "type": "string"
                  },
                  "type": {
                    "type": "string"
                  },
                  "kind": {
                    "type": "string"
                  },
                  "scope": {
                    "type": "string"
                  },
                  "module": {
                    "type": "string"
                  },
                  "bit_select": {
                    "type": "string",
                    "description": "Present when the query used a bit-select (e.g. '[3]', '[7:4]'): both drivers and loads are narrowed to the readers/writers that actually touch those bits."
                  },
                  "driver": {
                    "oneOf": [
                      {
                        "type": "object",
                        "properties": {
                          "kind": {
                            "type": "string"
                          },
                          "source": {
                            "type": "string"
                          },
                          "description": {
                            "type": "string"
                          },
                          "symbol": {
                            "type": "string"
                          },
                          "symbol_kind": {
                            "type": "string"
                          },
                          "scope_path": {
                            "type": "string"
                          },
                          "bits": {
                            "type": "string",
                            "description": "Normalized bit offsets this driver covers ('[3]' / '[7:4]'); absent when it drives the whole signal."
                          },
                          "file": {
                            "type": "string"
                          },
                          "line": {
                            "type": "integer"
                          },
                          "logic": {
                            "type": "object",
                            "description": "Present with --logic: this driver's value logic.",
                            "properties": {
                              "timing": {
                                "type": "object",
                                "description": "sequential (clock/reset) | combinational | latch."
                              },
                              "assignments": {
                                "type": "array",
                                "items": {
                                  "type": "object",
                                  "properties": {
                                    "lhs": {
                                      "type": "string"
                                    },
                                    "rhs_text": {
                                      "type": "string",
                                      "description": "Source text of the RHS."
                                    },
                                    "rhs_operands": {
                                      "type": "array",
                                      "items": {
                                        "type": "object",
                                        "required": [
                                          "name",
                                          "path"
                                        ],
                                        "properties": {
                                          "name": {
                                            "type": "string"
                                          },
                                          "path": {
                                            "type": "string",
                                            "description": "Hierarchical path of the operand."
                                          },
                                          "bits": {
                                            "type": "string",
                                            "description": "Bit range read, e.g. '[7:0]'."
                                          }
                                        },
                                        "additionalProperties": true
                                      }
                                    },
                                    "guards": {
                                      "type": "array",
                                      "items": {
                                        "type": "object"
                                      },
                                      "description": "Guard chain (if/case conditions + polarity) that must hold for this branch to be active."
                                    },
                                    "file": {
                                      "type": "string"
                                    },
                                    "line": {
                                      "type": "integer"
                                    }
                                  },
                                  "additionalProperties": true
                                }
                              }
                            },
                            "additionalProperties": true
                          }
                        },
                        "additionalProperties": true
                      },
                      {
                        "type": "null"
                      }
                    ]
                  },
                  "extra_drivers": {
                    "type": "array",
                    "items": {
                      "type": "object",
                      "properties": {
                        "kind": {
                          "type": "string"
                        },
                        "source": {
                          "type": "string"
                        },
                        "description": {
                          "type": "string"
                        },
                        "symbol": {
                          "type": "string"
                        },
                        "symbol_kind": {
                          "type": "string"
                        },
                        "scope_path": {
                          "type": "string"
                        },
                        "bits": {
                          "type": "string",
                          "description": "Normalized bit offsets this driver covers ('[3]' / '[7:4]'); absent when it drives the whole signal."
                        },
                        "file": {
                          "type": "string"
                        },
                        "line": {
                          "type": "integer"
                        },
                        "logic": {
                          "type": "object",
                          "description": "Present with --logic: this driver's value logic.",
                          "properties": {
                            "timing": {
                              "type": "object",
                              "description": "sequential (clock/reset) | combinational | latch."
                            },
                            "assignments": {
                              "type": "array",
                              "items": {
                                "type": "object",
                                "properties": {
                                  "lhs": {
                                    "type": "string"
                                  },
                                  "rhs_text": {
                                    "type": "string",
                                    "description": "Source text of the RHS."
                                  },
                                  "rhs_operands": {
                                    "type": "array",
                                    "items": {
                                      "type": "object",
                                      "required": [
                                        "name",
                                        "path"
                                      ],
                                      "properties": {
                                        "name": {
                                          "type": "string"
                                        },
                                        "path": {
                                          "type": "string",
                                          "description": "Hierarchical path of the operand."
                                        },
                                        "bits": {
                                          "type": "string",
                                          "description": "Bit range read, e.g. '[7:0]'."
                                        }
                                      },
                                      "additionalProperties": true
                                    }
                                  },
                                  "guards": {
                                    "type": "array",
                                    "items": {
                                      "type": "object"
                                    },
                                    "description": "Guard chain (if/case conditions + polarity) that must hold for this branch to be active."
                                  },
                                  "file": {
                                    "type": "string"
                                  },
                                  "line": {
                                    "type": "integer"
                                  }
                                },
                                "additionalProperties": true
                              }
                            }
                          },
                          "additionalProperties": true
                        }
                      },
                      "additionalProperties": true
                    }
                  },
                  "multi_driver_warning": {
                    "type": "boolean",
                    "description": "True only when driver bit ranges overlap; multiple drivers over disjoint ranges (per-bit generate outputs) are legal and not flagged."
                  },
                  "loads": {
                    "type": "array",
                    "items": {
                      "type": "object",
                      "properties": {
                        "kind": {
                          "type": "string"
                        },
                        "description": {
                          "type": "string"
                        },
                        "scope_path": {
                          "type": "string"
                        },
                        "instance": {
                          "type": "string"
                        },
                        "port": {
                          "type": "string"
                        },
                        "direction": {
                          "type": "string"
                        },
                        "bits": {
                          "type": "string",
                          "description": "Bit sub-range of the signal this load reads ('[3]' / '[7:4]'); absent when it reads the whole signal."
                        },
                        "file": {
                          "type": "string"
                        },
                        "line": {
                          "type": "integer"
                        }
                      },
                      "additionalProperties": true
                    }
                  },
                  "load_count": {
                    "type": "integer"
                  }
                },
                "additionalProperties": true
              }
            }
          }
        },
        {
          "type": "null"
        }
      ]
    },
    "diagnostics": {
      "type": "array",
      "items": {
        "type": "object",
        "required": [
          "severity",
          "file",
          "line",
          "col",
          "message"
        ],
        "properties": {
          "severity": {
            "type": "string",
            "enum": [
              "error",
              "warning",
              "note",
              "info"
            ]
          },
          "file": {
            "type": "string"
          },
          "line": {
            "type": "integer",
            "minimum": 0
          },
          "col": {
            "type": "integer",
            "minimum": 0
          },
          "message": {
            "type": "string"
          }
        },
        "additionalProperties": false
      }
    },
    "errors": {
      "type": "array",
      "items": {
        "type": "object",
        "required": [
          "code",
          "message"
        ],
        "properties": {
          "code": {
            "type": "string",
            "enum": [
              "INPUT_NOT_FOUND",
              "BAD_FILELIST",
              "COMPILE_FAILED",
              "SCOPE_NOT_FOUND",
              "SIGNAL_NOT_FOUND",
              "BAD_CONFIG",
              "NO_TOP",
              "INTERNAL_ERROR"
            ]
          },
          "message": {
            "type": "string"
          },
          "details": {
            "type": "object",
            "description": "Machine-readable recovery hints. For SCOPE_NOT_FOUND: valid_prefix, failing_component, close_matches, children. For SIGNAL_NOT_FOUND: close_matches, available."
          }
        },
        "additionalProperties": false
      }
    },
    "summary": {
      "oneOf": [
        {
          "type": "object",
          "required": [
            "mode",
            "results"
          ],
          "properties": {
            "mode": {
              "type": "string"
            },
            "results": {
              "type": "integer"
            },
            "drivers": {
              "type": "integer"
            },
            "loads": {
              "type": "integer"
            },
            "truncated": {
              "type": "boolean",
              "description": "True when an emitted list was capped by --limit; the count fields still report the true totals."
            },
            "limit": {
              "type": "integer",
              "description": "Effective per-list item cap that was applied (0 means unlimited)."
            }
          }
        },
        {
          "type": "null"
        }
      ]
    }
  },
  "additionalProperties": false
}
